{
  "source": "https://oehha.ca.gov/proposition-65/proposition-65-list",
  "regulation": "California Safe Drinking Water and Toxic Enforcement Act of 1986 (Proposition 65), Cal. Health & Safety Code §25249.5 et seq.",
  "snapshot_date": "2026-01-15",
  "note": "Curated subset of the OEHHA Proposition 65 list for the PoC. The full official list contains approximately 900 chemicals known to the State of California to cause cancer, birth defects, or other reproductive harm. Production would refresh this file on a schedule from oehha.ca.gov. Substance names, CAS numbers, and listing dates are public regulatory data; reasons for inclusion are summarised from OEHHA's published rationale.",
  "substances": [
    {
      "cas": "7439-92-1",
      "name": "Lead",
      "reason_for_inclusion": "Carcinogen; developmental toxicant; male and female reproductive toxicant",
      "date_added": "1987-10-01"
    },
    {
      "cas": "7758-97-6",
      "name": "Lead chromate",
      "reason_for_inclusion": "Carcinogen",
      "date_added": "1988-01-01"
    },
    {
      "cas": "301-04-2",
      "name": "Lead acetate",
      "reason_for_inclusion": "Carcinogen; developmental toxicant",
      "date_added": "1987-10-01"
    },
    {
      "cas": "7440-43-9",
      "name": "Cadmium",
      "reason_for_inclusion": "Carcinogen; developmental toxicant; male reproductive toxicant",
      "date_added": "1987-10-01"
    },
    {
      "cas": "1306-19-0",
      "name": "Cadmium oxide",
      "reason_for_inclusion": "Carcinogen",
      "date_added": "1988-04-01"
    },
    {
      "cas": "7439-97-6",
      "name": "Mercury and mercury compounds",
      "reason_for_inclusion": "Developmental toxicant",
      "date_added": "1990-07-01"
    },
    {
      "cas": "1333-82-0",
      "name": "Chromium (hexavalent compounds)",
      "reason_for_inclusion": "Carcinogen",
      "date_added": "1987-10-01"
    },
    {
      "cas": "7758-97-6",
      "name": "Lead chromate",
      "reason_for_inclusion": "Carcinogen",
      "date_added": "1988-01-01"
    },
    {
      "cas": "50-00-0",
      "name": "Formaldehyde (gas)",
      "reason_for_inclusion": "Carcinogen",
      "date_added": "1988-01-01"
    },
    {
      "cas": "71-43-2",
      "name": "Benzene",
      "reason_for_inclusion": "Carcinogen; developmental toxicant; male and female reproductive toxicant",
      "date_added": "1987-02-27"
    },
    {
      "cas": "117-81-7",
      "name": "Bis(2-ethylhexyl) phthalate (DEHP)",
      "reason_for_inclusion": "Carcinogen; developmental toxicant; male reproductive toxicant",
      "date_added": "1987-10-01"
    },
    {
      "cas": "84-74-2",
      "name": "Di-n-butyl phthalate (DBP)",
      "reason_for_inclusion": "Developmental toxicant; male and female reproductive toxicant",
      "date_added": "2006-12-02"
    },
    {
      "cas": "85-68-7",
      "name": "Butyl benzyl phthalate (BBP)",
      "reason_for_inclusion": "Developmental toxicant",
      "date_added": "2005-12-02"
    },
    {
      "cas": "80-05-7",
      "name": "Bisphenol A (BPA)",
      "reason_for_inclusion": "Female reproductive toxicant",
      "date_added": "2015-05-11"
    },
    {
      "cas": "25637-99-4",
      "name": "Hexabromocyclododecane (HBCDD)",
      "reason_for_inclusion": "Developmental toxicant",
      "date_added": "2017-04-21"
    },
    {
      "cas": "79-01-6",
      "name": "Trichloroethylene (TCE)",
      "reason_for_inclusion": "Carcinogen; developmental toxicant",
      "date_added": "1988-04-01"
    },
    {
      "cas": "56-23-5",
      "name": "Carbon tetrachloride",
      "reason_for_inclusion": "Carcinogen",
      "date_added": "1987-10-01"
    },
    {
      "cas": "75-09-2",
      "name": "Methylene chloride (dichloromethane)",
      "reason_for_inclusion": "Carcinogen",
      "date_added": "1988-04-01"
    },
    {
      "cas": "75-01-4",
      "name": "Vinyl chloride",
      "reason_for_inclusion": "Carcinogen",
      "date_added": "1987-02-27"
    },
    {
      "cas": "91-20-3",
      "name": "Naphthalene",
      "reason_for_inclusion": "Carcinogen",
      "date_added": "2002-04-19"
    },
    {
      "cas": "106-99-0",
      "name": "1,3-Butadiene",
      "reason_for_inclusion": "Carcinogen; developmental toxicant; male and female reproductive toxicant",
      "date_added": "1987-04-01"
    },
    {
      "cas": "335-67-1",
      "name": "Perfluorooctanoic acid (PFOA)",
      "reason_for_inclusion": "Carcinogen; developmental toxicant",
      "date_added": "2017-11-10"
    },
    {
      "cas": "1763-23-1",
      "name": "Perfluorooctane sulfonic acid (PFOS)",
      "reason_for_inclusion": "Developmental toxicant",
      "date_added": "2021-12-31"
    },
    {
      "cas": "10043-35-3",
      "name": "Boric acid",
      "reason_for_inclusion": "Developmental toxicant; male reproductive toxicant",
      "date_added": "2018-12-28"
    },
    {
      "cas": "75-21-8",
      "name": "Ethylene oxide",
      "reason_for_inclusion": "Carcinogen; developmental toxicant; male and female reproductive toxicant",
      "date_added": "1987-07-01"
    },
    {
      "cas": "1330-43-4",
      "name": "Disodium tetraborate, anhydrous (Borax)",
      "reason_for_inclusion": "Developmental toxicant; male reproductive toxicant",
      "date_added": "2018-12-28"
    },
    {
      "cas": "7440-38-2",
      "name": "Arsenic and inorganic arsenic compounds",
      "reason_for_inclusion": "Carcinogen; developmental toxicant",
      "date_added": "1987-02-27"
    },
    {
      "cas": "1332-21-4",
      "name": "Asbestos",
      "reason_for_inclusion": "Carcinogen",
      "date_added": "1987-02-27"
    },
    {
      "cas": "108-95-2",
      "name": "Phenol",
      "reason_for_inclusion": "Developmental toxicant",
      "date_added": "1992-07-01"
    },
    {
      "cas": "1336-36-3",
      "name": "Polychlorinated biphenyls (PCBs)",
      "reason_for_inclusion": "Carcinogen; developmental toxicant",
      "date_added": "1987-10-01"
    }
  ]
}
